[
  {"schema_name":"wearable_normalized_activity","schema_version":"1.0.0","request_id":"wearable-req-synthetic-a","import_request_id":"wearable-req-synthetic-a","activity_id":"wearable-activity-00000000000000000001","source_sha256":"0000000000000000000000000000000000000000000000000000000000000001","started_at_unix":1784678400,"duration_seconds":7200,"distance_km":20.0,"ascent_m":800.0,"gps_present":true,"heart_rate_present":true,"average_heart_rate_bpm":150.0},
  {"schema_name":"wearable_normalized_activity","schema_version":"1.0.0","request_id":"wearable-req-synthetic-b","import_request_id":"wearable-req-synthetic-b","activity_id":"wearable-activity-00000000000000000002","source_sha256":"0000000000000000000000000000000000000000000000000000000000000002","started_at_unix":1784764800,"duration_seconds":3600,"distance_km":10.0,"ascent_m":300.0,"gps_present":true,"heart_rate_present":false,"average_heart_rate_bpm":null},
  {"schema_name":"wearable_normalized_activity","schema_version":"1.0.0","request_id":"wearable-req-synthetic-c","import_request_id":"wearable-req-synthetic-c","activity_id":"wearable-activity-00000000000000000003","source_sha256":"0000000000000000000000000000000000000000000000000000000000000003","started_at_unix":1784851200,"duration_seconds":1800,"distance_km":5.0,"ascent_m":null,"gps_present":false,"heart_rate_present":false,"average_heart_rate_bpm":null}
]
